task_id	name	status	priority	issue_type	app_section	owner	parent	notes	created_at	completed_at
1213142138288924	drag and drop folder and layer	Completed			File System	Unassigned		should be improved show a line where I will drop project or highlight the folder to drop in a folder if it is collapsed	2026-02-05 16:47:13	2026-02-06 18:14:15
1213070073876381	remove date from file folder layer view, add to canvas preview area under title	Completed			File System	Unassigned			2026-02-01 16:22:36	2026-02-06 18:14:21
1213070073876335	Restore keyframe property copy/paste	Completed			General	Unassigned		Feature Request: Bring back copy keyframe properties paste keyframe properties.\n\nContext: This functionality appears to have been removed or is currently missing from the Properties panel.\n\nExpected Behavior: \n\n    Users should be able to copy properties from one keyframe\n    Paste those properties to other keyframes\n    Maintain all property values and settings during copy/paste operation	2026-02-01 15:49:04	2026-02-06 18:15:01
1213387118254139	new folder bug, cant move cant rename	Completed			General	Unassigned			2026-02-22 20:01:30	2026-02-23 09:19:09
1213103523813977	Allow Style settings in group to over ride or change  settings for all contained layers	Completed			Timeline	Unassigned			2026-02-03 18:32:29	2026-02-05 16:29:25
1213070073876284	Allow first keyframe repositioning	Completed			Timeline	Unassigned		Issue: I should be able to move the first keyframe before it is the first keyframe of a layer timeline bar.\n\nExpected Behavior: First keyframe should be moveable to any position on the timeline, allowing for flexible timeline arrangement.	2026-02-01 15:46:20	2026-02-05 16:29:29
1213070073876288	Cross-project layer copy/paste	Completed			Timeline	Unassigned		Feature Request: Allow for copy pasting of layers and groups across projects.\n\nContext: Basic copy/paste functionality for layers and groups within projects is already implemented. Need to extend this capability to work between different projects.\n\nExpected Behavior: Users should be able to copy layers/groups from one project and paste them into another project.	2026-02-01 15:46:21	2026-02-05 16:29:31
1213070073876286	Double-click keyframe creation	Completed			Timeline	Unassigned		Issue: I should be able to double click anywhere on timeline to add a second keyframe (currently I need to move the timeline scrubber to be able to do it).\n\nAdditional Requirement: Timeline position line should move to where double click occurred.\n\nExpected Behavior: Double-clicking any timeline position should create a keyframe at that exact location and move the scrubber there.\n\nDouble clicking on an existing keyframe should remove it	2026-02-01 15:46:20	2026-02-03 18:07:05
1213070073876292	Fix end frame behavior issues	Completed			Timeline	Unassigned		Issue: There is some wonky behavior with the end frames (stress test required).\n\nSpecific Problems:\n\n    Last frame isn't working as expected\n    I should be able to move first frame\n    The only way to resize the layer bar should be by moving the first or last frame\n\nAction Required: Conduct stress testing to identify and resolve end frame manipulation issues.	2026-02-01 15:46:21	2026-02-03 18:07:08
1213070073876290	Fix loop mode keyframe editing	Completed			Timeline	Unassigned		Issue: Selecting loop on a layer makes editing the last key frame not possible.\n\nProposed Solution: Move the loop icon on the layer to the left of the drag icon (folder column).\n\nExpected Behavior: When loop mode is enabled, users should still be able to edit the last keyframe. Moving the loop icon should resolve UI conflicts.	2026-02-01 15:46:21	2026-02-03 17:55:45
1213103502476649	Fix looping of layer	Completed			Timeline	Unassigned			2026-02-03 17:06:25	2026-02-03 18:06:54
1213103523813974	There is a big where when I ed	Completed			Timeline	Unassigned			2026-02-03 18:32:16	2026-02-06 18:15:54
1213103523813980	layer order doesn't affect canvas	Completed			Timeline	Unassigned			2026-02-03 20:32:58	2026-02-03 20:33:11
1213103502476646	restore double click to add and remove keyframes	Completed			Timeline	Unassigned			2026-02-03 17:06:11	2026-02-03 18:07:45
43fda07e-34c8-4f39-b8f1-6fec3979fbe4		Completed							2026-04-26 13:47:56	
1213589928739629	3D Aminos dont' fill in color	Completed				Alexa			2026-03-10 10:27:05	2026-03-24 22:29:59
1213070073876348	Add icosahedron shape support	Completed				Unassigned		Enhancement: Add ability to add icosahedrons.\n\nExpected Behavior: Users should be able to create icosahedron shapes as part of the available geometry options in the editor.	2026-02-01 15:50:21	2026-02-05 22:26:09
1213070073876352	Add layer grouping with animation support	Completed				Unassigned		Enhancement: Ability to group layers of shapes and apply animation and keyframes, groups should be collapsible in the layer/timeline panel.\n\nExpected Behavior: \n\n    Users can select multiple layers and group them\n    Groups can have their own animations and keyframes applied\n    Groups appear as collapsible items in the layer/timeline panel\n    Nested animation hierarchy support	2026-02-01 15:50:22	2026-02-05 22:25:52
1213070073876315	Add properties to groups	Completed				Unassigned		Task: Add properties to groups.\n\nStatus: Completed (crossed out in original list)\n\nExpected Behavior: Group objects should have their own property panels and settings, similar to individual layers.	2026-02-01 15:47:05	2026-02-01 15:47:37
1213783121489120	Call shapes used as part of Jason file	Completed				Unassigned	extract aminos and horoscope from player code ---->		2026-03-24 22:28:23	2026-04-22 18:47:50
1213422326879711	Copy pasting between tabs is not working precisely (fix)	Completed				Unassigned			2026-02-24 12:55:11	2026-04-22 18:48:36
1213589928739641	Create a circle of astrological signs	Completed				Alexa			2026-03-10 10:41:39	2026-03-17 09:23:59
1213589928739635	Create a circle of iching	Completed				Alexa			2026-03-10 10:41:22	2026-03-17 09:23:56
1213589928739638	Create of aminoacids from SVGS	Completed				Alexa			2026-03-10 10:41:31	2026-03-17 09:23:58
1213387118254130	Current behavior over rides AFTER but doesn't apply to new layers	Completed				Unassigned	Set Default Colors  and lines for new layers in Project Settings		2026-02-22 19:09:27	2026-04-22 18:44:10
1213070073876321	Fix position property timing	Completed				Unassigned		Task: Position Y and X should apply before instances repetition.\n\nStatus: Completed (crossed out in original list)\n\nExpected Behavior: When using instance repetition, position transformations should be calculated and applied before the repetition occurs, not after.	2026-02-01 15:47:06	2026-02-01 15:47:29
1213589928739632	I need to be able to add complex SVGs not single line	Completed				Alexa			2026-03-10 10:27:14	2026-03-10 15:16:29
1213070073876364	Improve line pulldown visual	Completed				Unassigned		Polish: Line pulldown swap to graphic 0---0---0 for center start middle.\n\nExpected Behavior: Replace text-based line alignment options with a visual graphic showing three connected points (0---0---0) to represent center, start, and middle alignment options.	2026-02-01 15:50:24	2026-02-01 15:52:23
1213783121489121	In export sepeerate out all pdifferent shapes into different JS files	Completed				Unassigned	extract aminos and horoscope from player code ---->		2026-03-24 22:28:48	2026-04-22 18:43:23
1213070073876319	Kill header play button	Completed				Unassigned		Task: Kill header "play" button.\n\nStatus: Completed (crossed out in original list)\n\nExpected Behavior: Remove the play button from the header area (likely replaced by the improved play button mentioned in previous tasks).	2026-02-01 15:47:05	2026-02-01 15:47:31
local-1776956514275-453925	Make background on thumbnails of uploaded svg files 50% gray	Completed				Unassigned			2026-04-23 15:01:54	2026-04-25 15:06:31
1213070073876317	Remove master timeline bar	Completed				Unassigned		Task: Remove the "master" timeline bar, it's not needed.\n\nStatus: Completed (crossed out in original list)\n\nExpected Behavior: Master timeline bar should be removed from the interface to simplify the timeline view.	2026-02-01 15:47:05	2026-02-01 15:47:32
1213387118254145	Save as Layer animation	Completed				Unassigned	I need a library of "layer" animation I can copy over into current animation		2026-02-22 20:43:49	2026-04-22 18:44:33
1213409298716108	add tooltips to keyframes	Completed				Unassigned			2026-02-23 17:45:02	2026-02-23 19:29:33
1213949550375702	create an option for inporting a folder of SVGS into a circle as instances (for other symbols in circl)	Completed				Alexa			2026-04-07 10:03:48	2026-04-22 13:27:00
1214168752190343	create an option for uploading a PNG as individual or group	Completed				Alexa			2026-04-21 11:24:16	2026-04-22 13:26:59
1213152762510379	d	Completed				Unassigned	change the way groups work. I don't need to select to layers to group		2026-02-06 17:43:18	2026-04-22 18:43:18
1213783121489118	in main app make sure all shapes use different code players	Completed				Unassigned	extract aminos and horoscope from player code ---->		2026-03-24 22:28:09	2026-04-22 18:44:19
1213783121489117	in main app,  make siure it's clean	Completed				Unassigned	extract aminos and horoscope from player code ---->		2026-03-24 22:27:59	2026-04-22 18:43:26
1213422326879705	make all export transparent	Completed				Unassigned			2026-02-24 12:29:03	2026-04-22 18:43:28
1213152751327500	s	Completed				Unassigned	Add mouse controller for realtime animation		2026-02-06 15:15:45	2026-04-22 18:44:31
1213070073876394	see notes	Completed				Unassigned	Rezible 0,0 Canvas		2026-02-02 11:18:47	2026-04-22 18:44:34
1213589928739647	the effects added to much weight to the player code on export, give me an option to toggle oon/off effects when exporting player code, and default it to off	Completed				Alexa			2026-03-10 10:49:49	2026-04-22 18:45:05
1213422326879699	there is a bug in molecules (size) and need to be filled out with remainign aminos	Completed				Unassigned			2026-02-24 12:11:34	2026-04-22 18:45:12
1213070073876313	Re-implement keyframe property copy/paste	Cancelled	High	UX/UI	General	Unassigned		Task: Re-implement copy/paste keyframe properties on top of layer panel.\n\nStatus: Completed (crossed out in original list)\n\nExpected Behavior: Users should be able to copy keyframe properties and paste them to other keyframes using controls in the layer panel header area.	2026-02-01 15:47:04	
1213387118254097	Copy Paste layers is not obvious	Cancelled	Medium	UX/UI	Timeline	Unassigned			2026-02-22 17:33:35	
1213070073876360	Fix keyframe creation before first frame	Cancelled	Medium	Bug	Timeline	Unassigned		Bug: I can't create key frames in front of the first keyframe.\n\nExpected Behavior: Users should be able to create keyframes at any position on the timeline, including before the current first keyframe.	2026-02-01 15:50:23	2026-02-23 19:21:11
1213070073876358	Fix keyframe creation outside layer bar	Cancelled	Medium	Bug	Timeline	Unassigned		Bug: I can create key frames outside the layer bar.\n\nExpected Behavior: Keyframe creation should be constrained to valid timeline positions within the layer bar boundaries.	2026-02-01 15:50:23	2026-02-23 19:21:08
1213070073876282	Fix layer bar keyframe attachment	Cancelled	Medium	Bug	Timeline	Unassigned		Issue: Layer bar is now detached from the second keyframe; it should not be resizable on its own, but automatically size from first keyframe to last keyframe in the bar.\n\nExpected Behavior: Layer bar should automatically span from first to last keyframe without independent resizing capability.	2026-02-01 15:46:19	2026-02-23 19:21:08
1213387118254133	need edit button on preview window in folder view	Cancelled	Low	UX/UI	General	Unassigned			2026-02-22 19:50:56	
local-1777824000000-1010	Asset copy on project share / transfer	Future Upgrades	Medium	Feature Request	General	Unassigned		Project rows reference asset IDs owned by the original user. Storage RLS enforces first path segment = auth.uid(), so the receiving user can't read the original blobs. When a project moves between users (share, duplicate-across-accounts, admin reassign), each referenced asset needs to be copied into the target user's space: new asset_folders / assets rows, new storage object at {new_user_id}/{new_asset_id}.{ext}, and every assetFolderId / assetId in the project's layers rewritten to point at the new ids. Consider an edge function that takes a project id + target user id and does the full clone in one shot.	2026-04-25 21:30:00	
1213387118254094	Need to be able to expand background, make animation not square	Future Upgrades	Medium	Feature Request	General	Unassigned		Show "App" background and animation border in viewer screen to see where animation goes\n\nMake canvas resizable, allow to set size and format (crops in out)	2026-02-22 17:33:29	
d4fce254-dc3f-4d35-b25c-021f6feb03b7	setup URL for app so we can start sharing links to it	Future Upgrades	Medium	Technical Debt	General	Unassigned		Replace geometry-sequencer-v2.vercel.app with a real custom domain so shareable links look professional. Manual DNS work — buy / point a domain, add it in the Vercel project settings, update the Supabase Auth redirect allowlist (and ideally Site URL once v1 is retired). No code change needed in this repo.	2026-04-25 21:50:53	
1213409303569226	Add Dot animation on a line	Future Upgrades	Medium	Feature Request		Unassigned		Expand on the  DOTS functionality\n\nFrom what it is now to it's own area\n\nDots\n\n Pulldown with these three options\n\nAdd dots to the vertices\n\nvariables:\n    size of dot ( #amount )\n    Dot offset from point  ( #amount )\n    Filled  or outline  (toggle)\n\nDots moving along a path (on top of path)\nVariables:\n    number of dots ( #amount )\n    size of dot ( #amount )\n    Speed of movement ( #amount )\n\nDotted Line (moves from line stroke properties) ( I believe this is a pixijs shader function)\n    Dash size   ( #amount )\n    Gap Size   ( #amount )\n    Speed of movement ( #amount ). - (marching ants effect)	2026-02-23 18:42:37	
1213070073876389	Create tiny little movies in thumbnail view	Future Upgrades	Medium	Ideas		Unassigned	video thumbnails	Project folders with names are great, but once you have a lot of animations, it's hard to set them apart\n\n\nproject folder view needs a thumbnail view, which takes up more of the horizontal screen so you can properly see animations with a smaller preview window. \n\nIt would actually be useful to have a draggable separator so you can resize preview and thumbnails to fit more thumbnails into the view or less depending on screen size.	2026-02-01 22:43:58	
1214168752190346	Make responsive	Future Upgrades	Medium	Feature Request		Alexa		Animations needs to be responsive to container window by default\n\nNeed controls in html and other exports to control this behavior as well as ability to set canvas size	2026-04-21 11:24:41	
local-1777824000000-1008	Asset rebuild Stage H — Optional vector rendering for SVG assets	Future Upgrades	Low	Feature Request	Animation Variables	Unassigned	Asset-based shapes rebuild (active initiative)	Branch feat/asset-vector-mode-stage-h. Spec in 2adf49a. Per-layer opt-in to true vector rendering for close-up / hero SVG layers where the 4x raster softens.\n\nConfig: vectorAsset?: boolean on LayerConfig (default false). Applies only when the resolved asset is image/svg+xml; raster mimes ignore the flag.\n\nAssetCache: split the cache into two maps keyed on (assetId, mode) where mode in {texture, vector}. Add getGraphicsContextSync(assetId) that loads via Assets.load({ src, data: { parseAsGraphicsContext: true } }). invalidate(assetId) clears both modes. Keep getTextureSync unchanged so the default fast path is untouched.\n\nRenderer: in the asset_set / asset_single branch, if effectiveConfig.vectorAsset && folderAssetEntry.mimeType === 'image/svg+xml', request the GraphicsContext and build new Graphics(ctx) instead of new Sprite(texture). Size via graphics.getLocalBounds() to compute the same targetMax / maxBound scale we apply to sprites. Fall back silently to the sprite path if the ctx is still loading.\n\nInspector: toggle next to the asset picker (Stage D UI). Only render the toggle when the current asset's mime is image/svg+xml. Label 'Crisp at any scale (vector)'. Helper text: 'Slower with many instances.'\n\nPerf guardrail: soft-warn (small text under the toggle) when instances * symmetryMultiplier > 24. No hard block.\n\nMigration: none needed — new optional field, default false.\n\nOut of scope: per-instance mode switching, auto-promoting to vector at high zoom. Keep the flag static per layer.	2026-04-25 21:30:00	
1213409303569238	Explore adding states that trigger elements (study rive)	Future Upgrades	Low	Ideas	Animation Variables	Unassigned			2026-02-23 19:34:08	
1213422319914136	can I change number of vertices in timelien as variable	Future Upgrades	Low	Feature Request	Animation Variables	Unassigned			2026-02-24 11:15:01	
1213070073876354	Add direct shape manipulation	Future Upgrades	Low	Ideas	Canvas	Unassigned		Enhancement: Ability to move and resize shapes when clicking on the screen with the mouse, a bounding box appears with handles to resize and rotate.\n\nExpected Behavior: \n\n    Click on shapes to select them directly in the viewport\n    Show bounding box with resize handles\n    Include rotation handles for direct manipulation\n    Real-time visual feedback during transformations	2026-02-01 15:50:22	
1213070073876356	Explore mouse-driven animation	Future Upgrades	Low	Ideas	Canvas	Unassigned		Enhancement: Explore adding an option that moving mouse drags animation. This would mean different things for different elements, or ask AI to implement on a instance animation with delay effect.\n\nExpected Behavior: \n\n    Mouse movement controls animation playback\n    Different behaviors for different element types\n    Consider AI-assisted implementation for complex animations\n    Include delay effects for instance animations	2026-02-01 15:50:23	
1213070073876391	Rezible 0,0 Canvas	Future Upgrades	Low	Feature Request	Canvas	Unassigned		Explore adding option for defining canvas when starting a project\n\nCanvas should allow for zoom in and out\n\non canvas	2026-02-02 11:18:06	
5e459251-6d03-4de6-a06a-7fa1b51f4c9f	Retire legacy astro/amino script bundles + toggles	Future Upgrades	Low	Technical Debt	Exporters			astro-data.js / amino-data.js (and the astro/amino export toggles) only feed legacy layer.type === "astrology" | "amino" projects. v2 migrates those to asset_set on load (useStore.ts:1182-1196), so for any project opened in v2 with seed folders set up, these bundles are unused. Auto-detect already returns false for migrated projects, and the toggles now hide entirely when not detected (done 2026-05-05).\n\nWhen retiring: (a) run a one-time scan — select id from projects where data::text like '%"type":"astrology"%' or data::text like '%"type":"amino"%' — to find any unmigrated stragglers and force-open them in v2 to migrate; (b) delete src/astro-entry.ts, src/amino-entry.ts, vite.astro.config.ts, vite.amino.config.ts, App/public/astro-data.js, App/public/amino-data.js, the build:astro/build:amino scripts in package.json; (c) drop usesAstro/usesAmino/includeAstro/includeAmino state and the gated toggle JSX from ExportModal.tsx + BatchExportModal.tsx; (d) drop the astro/amino branches from loadPlayerBundles in src/utils/exportHelpers.ts and the bundle paths in batchExport.ts. Coordinate with v1 retirement — v1 may still emit legacy layer types.	2026-05-05 12:08:12	
1213070073876386	video thumbnails	Future Upgrades	Low	Enhancement	Front Page	Unassigned		Create a thumbnail view of the file browser\n\nUse this thumbnail view later as home page placholders\n\nbnails?\n\nlittle mmoves of animations! yes\n\nupdated file	2026-02-01 22:41:37	
1213142138288918	Add a golden ratio shape	Future Upgrades	Low	Ideas	General	Unassigned			2026-02-05 16:46:09	
1213891513519209	build a framer export	Future Upgrades	Low	Ideas	General	Alexa			2026-04-01 20:52:29	
64eb75fd-4760-4bf1-a978-842953a6a10a	switch ui to shadcn cleaner and more polished	Future Upgrades	Low	Ideas	General	Unassigned		Move whole UI from current custom Tailwind components to shadcn primitives for a more polished/consistent look. Multi-day refactor; needs scoping before kickoff: which screens first (Inspector vs Dashboard vs Auth), keep current dark theme or adopt shadcn defaults, whether to do a big-bang swap or incrementally per screen.	2026-04-25 21:40:15	
1213387118254105	Export is not visible on white background	Future Upgrades	Low	UX/UI	Timeline	Unassigned			2026-02-22 17:34:06	
1213070073876296	Improve play button visibility	Future Upgrades	Low	UX/UI	Timeline	Unassigned		Enhancement: Put circle around play triangle make icon more obvious.\n\nExpected Behavior: Play button should be more visually prominent and easier to identify in the interface.	2026-02-01 15:46:22	
1213070073876333	Add double-click rename functionality	Future Upgrades	Low			Unassigned		Feature Request: Double clicking on text in folder should trigger rename.\n\nExpected Behavior: \n\n    Double-clicking on any text/name in folder view should immediately enter rename mode\n    Should work consistently across all file/folder items\n    Provide clear visual feedback when in rename mode	2026-02-01 15:49:04	
c4b1f66f-c2ed-421a-b866-3efa525e2c4e	Allow me to sort projects manually or alphabetically (requires migration from V1)	Idea							2026-05-05 10:13:59	
b06a19c9-82cf-4d9d-8943-0dc73936acf9	need to be able to sort project in thumbnails	Idea							2026-05-06 09:10:46	
0acf818a-b7ba-4969-aedb-4b3c6bb728f0	allow for sorting alphabetically and manually	Idea							2026-05-06 09:11:03	
a6e04e97-6fb0-4342-b6f8-16b496de8d27	need thumbnails on html export for index page, use last frame or give option)	Idea							2026-05-06 09:11:17	
